{
  "artifact_kind": "whole-book-assembly",
  "schema_version": "1.0.0",
  "repository_revision": "1463a06437fc903edec24722ecbb686a46d8f9da",
  "generated_at": "2026-09-22T00:00:00Z",
  "assembly_id": "WHOLE-BOOK-ASSEMBLY-8888888888888888888888888888888888888888888888888888888888888888",
  "run_plan_id": "CURRICULUM-RUN-PLAN-7777777777777777777777777777777777777777777777777777777777777777",
  "run_plan_sha256": "2222222222222222222222222222222222222222222222222222222222222222",
  "run_state_id": "CURRICULUM-RUN-STATE-1111111111111111111111111111111111111111111111111111111111111111",
  "run_state_revision": 1,
  "run_state_sha256": "3333333333333333333333333333333333333333333333333333333333333333",
  "run_state_schema_version": "1.0.0",
  "snapshot_kind": "worktree",
  "source_metadata": {
    "snapshot_kind": "worktree",
    "g01_status": "PASS",
    "unknown_files": 0,
    "project_index_sha256": "aaaaaaaaaaaaaaaaaaaaaaaaaaaaaaaaaaaaaaaaaaaaaaaaaaaaaaaaaaaaaaaa",
    "coverage_sha256": "bbbbbbbbbbbbbbbbbbbbbbbbbbbbbbbbbbbbbbbbbbbbbbbbbbbbbbbbbbbbbbbb"
  },
  "source_status": "PASS",
  "source_run_manifest_sha256": "cccccccccccccccccccccccccccccccccccccccccccccccccccccccccccccccc",
  "unknown_files": 0,
  "curriculum_schema_version": "1.1.0",
  "curriculum_sha256": "dddddddddddddddddddddddddddddddddddddddddddddddddddddddddddddddd",
  "input_digests": [
    {"role":"phase4_base_graph","artifact_kind":"knowledge-graph","schema_version":"1.1.0","sha256":"1111111111111111111111111111111111111111111111111111111111111111"},
    {"role":"phase4_base_evidence","artifact_kind":"evidence","schema_version":"1.2.0","sha256":"2222222222222222222222222222222222222222222222222222222222222222"},
    {"role":"phase4_semantic_proposals","artifact_kind":"semantic-proposals","schema_version":"1.0.0","sha256":"3333333333333333333333333333333333333333333333333333333333333333"},
    {"role":"phase4_claim_candidates","artifact_kind":"claim-candidates","schema_version":"1.1.0","sha256":"4444444444444444444444444444444444444444444444444444444444444444"},
    {"role":"phase4_claim_evidence","artifact_kind":"claim-evidence","schema_version":"1.1.0","sha256":"5555555555555555555555555555555555555555555555555555555555555555"},
    {"role":"phase4_claim_evidence_graph","artifact_kind":"claim-evidence-graph","schema_version":"1.0.0","sha256":"6666666666666666666666666666666666666666666666666666666666666666"},
    {"role":"phase5_prerequisite_candidates","artifact_kind":"prerequisite-candidates","schema_version":"1.0.0","sha256":"7777777777777777777777777777777777777777777777777777777777777777"},
    {"role":"phase5_prerequisite_graph","artifact_kind":"prerequisite-graph","schema_version":"1.0.0","sha256":"8888888888888888888888888888888888888888888888888888888888888888"},
    {"role":"phase5_curriculum_candidates","artifact_kind":"curriculum-candidates","schema_version":"1.0.0","sha256":"9999999999999999999999999999999999999999999999999999999999999999"},
    {"role":"phase5_curriculum","artifact_kind":"curriculum","schema_version":"1.1.0","sha256":"0000000000000000000000000000000000000000000000000000000000000000"}
  ],
  "unit_count": 2,
  "selected_count": 1,
  "units": [
    {
      "position": 1,
      "unit_id": "CURRICULUM-UNIT-1111111111111111111111111111111111111111111111111111111111111111",
      "unit_identity": {"id":"CURRICULUM-UNIT-1111111111111111111111111111111111111111111111111111111111111111","title":"Fixture lesson"},
      "unit_identity_sha256": "aaaaaaaaaaaaaaaaaaaaaaaaaaaaaaaaaaaaaaaaaaaaaaaaaaaaaaaaaaaaaaaa",
      "route": "D2A_GENERAL_LEARNING",
      "plan_state": "PLANNED",
      "reason_codes": ["ROUTE_GENERAL_CANDIDATE"],
      "blocked_by": [],
      "prerequisite_ids": [],
      "execution_state": "REVIEWED_DRAFT",
      "selection_state": "SELECTED",
      "attempt_id": "attempt-0001",
      "review_state": "REVIEWED_DRAFT",
      "review_status_sha256": "bbbbbbbbbbbbbbbbbbbbbbbbbbbbbbbbbbbbbbbbbbbbbbbbbbbbbbbbbbbbbbbb",
      "artifact_digests": [],
      "answer_status": "INCLUDED"
    },
    {
      "position": 2,
      "unit_id": "CURRICULUM-UNIT-2222222222222222222222222222222222222222222222222222222222222222",
      "unit_identity": {"id":"CURRICULUM-UNIT-2222222222222222222222222222222222222222222222222222222222222222","title":"Unselected fixture lesson"},
      "unit_identity_sha256": "cccccccccccccccccccccccccccccccccccccccccccccccccccccccccccccccc",
      "route": "PHASE6A_PROJECT_CLAIM",
      "plan_state": "PLANNED",
      "reason_codes": ["ROUTE_PROJECT_CLAIM_SUPPORTED"],
      "blocked_by": [],
      "prerequisite_ids": [],
      "execution_state": "PLANNED",
      "selection_state": "NOT_SELECTED",
      "attempt_id": null,
      "review_state": null,
      "review_status_sha256": null,
      "artifact_digests": [],
      "answer_status": "NOT_SELECTED"
    }
  ],
  "lesson_status": "DRAFT",
  "answer_book_status": "DRAFT",
  "overall_status": "PARTIAL",
  "cross_chapter_audit": "NOT_RUN",
  "outputs": [
    {"role":"whole_book","path":"WHOLE-BOOK.md","sha256":"4444444444444444444444444444444444444444444444444444444444444444"},
    {"role":"answer_book","path":"WHOLE-ANSWER-BOOK.md","sha256":"5555555555555555555555555555555555555555555555555555555555555555"},
    {"role":"quality_and_gaps","path":"QUALITY-AND-GAPS.md","sha256":"6666666666666666666666666666666666666666666666666666666666666666"}
  ]
}
